author_id,username,author_followers,author_tweets,author_description,author_location,text,created_at,retweets,replies,likes,quote_count
1260746768586866693,CatBusRuss,65,2639,"“CoolMoviesDarth” Russ Stevens: Zombie movie writer/producer, Underemployed pro-wrestler, Podcast host, Keeping cat(s) in the comfort their godliness demands.","Urbana, IL by way of Peoria","Really dug @2chancemovies “Small Soldiers” episode. Don’t dig @thejoeharper’s “better than G******s” assessment. If @peacock can have the @HarryPotterFilm, why not a “Soldiers v. #Gremlins” movie? 

#FilmTwitter @hardwick @JessKwazz @RonFunches 

https://t.co/uwZteswD14",2021-08-01 22:48:01+00:00,0,0,2,1
238764045,therealrobbie84,104,6606,"Seattle native. Avid fan of sports, pro wrestling, politics, and traveling. Black sheep. Creature of habit. 1994 World Series Champion. #Impeach45","47.6097° N, 122.3331° W",@HowardBeck No idea when any games are on or where at… horrible marketing by @nbc and @peacock,2021-08-01 15:43:56+00:00,0,0,1,0
15255705,q256,244,6464,"Male, Single, Easy Going, Bald, Fat, Little Winkie, Grey Matter, Geek, Pictures, Bowl, Golf, Cook, Travel aka See The World, Enjoy Life and Having Fun","ÜT: 47.57097,-122.541777","By far the worst @NBCOlympics ( @Hulu @Peacock ) coverage EVER to date

#TuneItOut #JustIsNotWorthTryingAnymore #ShitIsShit",2021-08-01 05:20:32+00:00,0,0,0,0
305075301,jMoNet07,35,5662,Have an Associate Degree in Applied Sciences Multimedia and Web Design view https://t.co/PIMUL9nufR and https://t.co/6fplPM552G  also https://t.co/IWMP58y9xN  &,,The Olympics is rather boring when can't afford pay to view athletes that are in the games without pay. @peacock isn't the best of interest to the lower class people. The primetime cast is delayed in planning process. The events already happened! Not everything is live!,2021-08-01 01:04:38+00:00,0,1,0,0
1414401601,CoachPaul82,145,3042,"Associate/Youth Pastor @TheOpenDoorpa. Married, Father of 3 boys.  Christian, Conservative, Capitalist.","Chambersburg, PA","@Outkick He’s not Michael Jordan. Not even close. Also, The Last Dance was so incredible because it came at a time when there was no live sports on. This is not going to end well for @peacock. At least their Olympic coverage has been so profitable. Oops, never mind.",2021-08-02 20:06:17+00:00,0,0,1,0
565066406,FalconEric012,540,16987,"Soap Opera Junkie, love Charlie's Angels, The Bionic Woman and lots of other stuff. Love all kinds of music, Lady Gaga is everything. Love The Cranberries.",Philadelphia,"@ReneeRevelation @peacock Yea I downloaded it on my phone but for some reason it doesn't show up on my tv in New apps. Free with commercials, pay for commercial free. I want commercial free for my #Days 😁",2021-08-02 19:43:19+00:00,0,0,0,0
565066406,FalconEric012,540,16987,"Soap Opera Junkie, love Charlie's Angels, The Bionic Woman and lots of other stuff. Love all kinds of music, Lady Gaga is everything. Love The Cranberries.",Philadelphia,@ReneeRevelation @SoapDigest @Christie__Clark @nbcdays I'm paying for Peacock when this series hits 😁 #DaysofourLives is worth it. @Peacock,2021-08-02 19:32:46+00:00,0,1,2,0
114530603,annie_aruok,134,8510,Hays in the barn. Pigs in the castle.,Chicago,"This has been the most horrific Olympics to watch because @peacock and @nbc apparently lost all ability to organize, notify, or make it clear when their programming is happening or available. Call @netflix and figure it out, damn.",2021-08-02 16:30:15+00:00,0,0,0,0
489956267,GailDrakes,1565,15973,Historian using lessons from the past to inform the present - and shape the future. Bringing social justice visions to both higher education and philanthropy.,"Brooklyn, New York (USA)","Wait, I just found out @MorganRadford has a show on @Peacock! A lot of voices I think are important are ending up on streaming, and since I’m watching on a tablet anyway, I’m gonna need to makes some changes… https://t.co/UP4m1D5RUl",2021-08-02 15:39:20+00:00,0,1,1,0
60280898,IamaTexansfan1,16,9162,Born raised and always be a Texan.  Retired Air Force.,"Richardson, Tx",@dpshow @peacock @NBCSports   @FoxSportsRadio Will not watch a show with Nick Wright on.  Over hyped ass.,2021-08-02 14:04:32+00:00,0,0,0,0
425187086,teemanning,412,10175,"Clemson & UGA grad. Creative spirit. Prince fan. Lover of chili dogs, reading, photography, good TV and curvy women (not in that order)","Savannah, GA",@MikeSooch @Josh_Moon @peacock @peacockTV It really has,2021-08-02 13:55:28+00:00,0,0,0,0
39118718,impalergeneral,495,47918,"Blogger and Staff writer at Whedonopolis, former radio reporter who got some praise from AP. Hoping my tweets today will be someone's riffs tomorrow","Reno, NV","@admiralmpj @NBCOlympics @peacockTV Oh, it'll happen in L-A, and maybe it'll all be on @peacock (but at least it's not the Triplecast, which costs more to see compared to Peacock)",2021-08-02 13:16:46+00:00,1,0,1,0
16564424,MikeSooch,1191,13973,"Mike Suchcicki (soo-chick-ee) - Writer, designer, artist. Created @Ghoulash (paper game & card game), backyard game Bushelball, and All Sorts Calming Cards.","Pensacola, Florida","@teemanning @Josh_Moon @peacock You would think that @peacockTV would have made Olympic viewing easier and more convenient, but it's been the opposite.",2021-08-02 13:12:16+00:00,0,1,2,0
425187086,teemanning,412,10175,"Clemson & UGA grad. Creative spirit. Prince fan. Lover of chili dogs, reading, photography, good TV and curvy women (not in that order)","Savannah, GA",@Josh_Moon And their insistence on putting premier events on @peacock is unforgivable,2021-08-02 11:53:35+00:00,0,1,2,0
1405987511172800514,oooo_penguins,5,590,Just here for random retweets as needed,,@nbc Please give Manifest to your offspring @peacock. Let them #SaveManifest https://t.co/XxtuBr2geQ,2021-08-02 01:25:05+00:00,0,0,0,0
1670206940,R0SEbudss,91,11970,tweeting into the void.,coleworld,fuck @peacock 5ever.  you could've told me #Drdeath only had one freebie episode… bastards,2021-08-02 01:24:19+00:00,0,0,0,0
35266667,GarettK,45,124,,,I feel like @peacock @NBCSports has missed a few opportunities to play a commercial.,2021-08-02 01:16:35+00:00,0,0,0,0
15487025,RunBlogRun,35180,210883,"RunBlogRun comments on the global world of athletics, sports & ethics, and the Olympic movement. RunBlogRun is the voice of the sport.",global,"Dear @NBCsports: Last night (8/1/21) was a historic night of track &amp; field, with a Women's TJ WR, tie for gold in Men's HJ, incredible Men's 100m final, semi finals in M 800m, W100m h, M100m, and M400m hurdles. How many know about @peacock? photo @stuartweir, @usatf, @nbcolympics https://t.co/SPFL9rZ9vc",2021-08-02 00:00:04+00:00,0,0,1,0
1243929924685172738,AdorkableMel,6,86,"Middle aged Mayhem, Swim/Run, Cook/Bake","St Petersburg, FL",Dear @NBC @peacock why are you not livestreaming? The very first marathon swim is taking place and I cannot find it anywhere. Your swim event coverage sucks. #worstbroadacast #NBC #PeacockTV #streaming #Tokyo2020 #openwaterswimming,2021-08-03 22:27:16+00:00,0,1,0,0
394501653,lylldy,4104,23051,https://t.co/VWLxoP0Dxh Mom #BLM Empath Nasty #CPP #NEVERaddict 🚫QoL  #PAINgry 🌎All Fauna/Flora🐝🦋🐕🐱🐴🐬🌳🌹 Amiga 🎶💃🤣#WaterIsLife #ERA 🖤💛,"A Hill in The Schuylk, PA USA",@nbcdays No tv since 7/19. Caught up w/ DoOL via @Peacock app last night. Tysvm! My earliest (b &amp; w tv) memory of Days is of teen Julie (SSH) w/ long dark hair in a white dress on a swing in Grandma &amp; Grandpa Hortons' backyard.😎,2021-08-03 16:51:01+00:00,0,0,0,0
1291557802369048581,cristinellashow,429,33992,"Hey It’s A Show is a BRIDGE THEATER Original using satire, parody, commedia & your tweets. This is a work of fiction. No © infringement intended.","Ambridge, PA",Will someone please tell me how to stream @peacock so I can enjoy @SnoopDogg narrating the Olympics? Thank you in advance.,2021-08-03 14:12:38+00:00,0,1,0,0
15326011,GFleming,174,90172,"Married to Lori, Father of 2, Angels Baseball, and Monopoly King","Orange County, CA.","usatf: World record holder / defending 🥇+ world champion / defending 🥈 + @NCAATrackField Indoor champion = The #TeamUSATF Men's Shot Put squad. Qualifying starts now! 

🇺🇸 @RCrouserThrows 
🇺🇸 @JoeKovacsUSA 
🇺🇸 @paytonotterdahl 

Watch live / @peacock… https://t.co/dCaj1Ypo2D",2021-08-03 10:32:05+00:00,0,0,0,0
895992086666915840,Super6Rugby,5714,2403,"The official Twitter of Scottish Rugby’s FOSROC Super6 competition. Exclusive in-game clips, highlights, tournament and team news.","Scotland, United Kingdom","@RFTalk @tubaguy08 @SuperRugby @USARugby @prsevens @WorldRugby7s @AmericaRugbyPod @peacock If you're outside of the UK &amp; Ireland, we have two games a weekend available to watch live on our website!  Check out https://t.co/c3garutcTn on Friday evening (@WATSONIANFC v @StirlingCounty) &amp; Sunday afternoon (@HeriotsRugby v @Sthrn_Knights ) BST.",2021-08-03 08:11:23+00:00,5,0,5,0
1220929133154308098,sickofgovlies,23,3911,,,@peacock can you make it so it saves where you are at in the series your watching?,2021-08-03 04:34:52+00:00,0,0,0,0
146732318,HotelGuySA,1390,13500,"Hotel/F&B Hero.
CA ➡️ OR ➡️ CA ➡️ TX 
Giants/Niners/Warriors fan -  Street cred level above 9000. #TheResistance #LaMisión #SFOG $ETH $LINK $QNT",Deep in the Heart of Texas ,@orionsarmy @YahooSports @NBCOlympics @peacockTV @peacock Thank you... and they give you an announcer who has no idea who @luka7doncic is.,2021-08-03 03:06:20+00:00,0,0,1,0
41061716,orionsarmy,390,12485,1.618 Follow the Light. The light is your guide. NBA opinionist. Fractal fan. Mandelbrot set 💎TheDonKilluminati🤴🏽,In Opposition of Saturn,@HotelGuySA @YahooSports @NBCOlympics @peacockTV @peacock NBC sports app. (Really) then go to live sports then scroll down until basketball. After you put in your subscriber info (DirecTV or what have you) - it’s bullshit you have to do all that to watch Luka play basketball in the Olympics.,2021-08-03 03:01:28+00:00,0,1,0,0
146732318,HotelGuySA,1390,13500,"Hotel/F&B Hero.
CA ➡️ OR ➡️ CA ➡️ TX 
Giants/Niners/Warriors fan -  Street cred level above 9000. #TheResistance #LaMisión #SFOG $ETH $LINK $QNT",Deep in the Heart of Texas ,@orionsarmy @YahooSports @NBCOlympics I looked for it on @peacockTV it's not on there. Is it on @Peacock+?,2021-08-03 02:56:48+00:00,0,1,0,0
1361868286544216064,CracasCade,10,210,Covering NBA/NFL News 24/7 | Host of The Triad | Future Sports Reporter,,@Peacock and #MagicJohnson have reportedly been working on a deal to create a docuseries about Magic Johnson’s life and career. The deal is reportedly close to $25 million.,2021-08-03 01:24:34+00:00,0,0,1,0
1222393587075338240,RFTalk,36,337,Committed to providing substandard coverage of American rugby,,"@tubaguy08 @SuperRugby @USARugby @prsevens @WorldRugby7s @AmericaRugbyPod If truly free is a requirement, I’ll suggest the @Super6Rugby. It’s the second level of Scottish rugby. They stream matches on YouTube. If you’re willing to fork over $5 a month, I’ll join the chorus supporting @peacock during the Prem/Champ Cup.",2021-08-03 00:54:35+00:00,0,1,2,0
15084579,radiosweethrt,212,35944,Dogs. Cats. General Hospital. Days of Our Lives. The important stuff.,,I wonder if #BeyondSalem is going to be @peacock premium subscriber-only or if it'll be available on the free side. #Days,2021-08-04 22:01:48+00:00,0,0,0,0
15440798,MikeCunsolo,264,20791,Hey...I'm Mike and I love LaDonna and my kids.,"Accra, Ghana","@netflix @peacock @hulu @discovery @disneyplus 

Think of it this way: I pay $30 a month for a dedicated VPN so I can watch shows. That’s $360 per year. Now think about that for each user. We’re talking millions of dollars you’re losing to VPNs. #thinkaboutit",2021-08-04 20:12:40+00:00,0,0,0,0
15440798,MikeCunsolo,264,20791,Hey...I'm Mike and I love LaDonna and my kids.,"Accra, Ghana","@netflix Also looking at you @Peacock @hulu @discovery @paramount @amazon @EVERYSTREAMSERVICE

If I missed anyone on this please let me know.

@sling",2021-08-04 19:58:56+00:00,0,0,1,0
32261756,boucher1113,23,6707,The right decisions are rarely the easy decisions.,"Roanoke, VA",@jessica_smetana And I don't have @peacockTV because of the principle. Not paying TWICE to be able to get all the games. I pay my cable sub and that once got me everything. @peacock out,2021-08-04 17:54:01+00:00,0,0,0,0
45662364,Drew_3DP,81,10487,"TX Born, FL Raised. Weather Nerd. Beautiful Game Fan (#CFC #RSL). Vols. Fins. Fish. Heat. #LightTheWorld. Papa of 2. Additive Mfg Tech. Tweets are MO.",DFW,@slmandel @Peacock is the absolute worst,2021-08-04 17:21:07+00:00,0,0,1,0
1022068185204449280,simonmckim,52,1680,"Host of @andalsoaswellas, fan of baseball, learner of Gàidhlig, and author","New Albany, IN",Hey @peacock please stop cutting to these two jackasses in the studio making fun of events and people’s names.,2021-08-04 11:14:35+00:00,0,0,1,0
975191599,rmalay75,75,416,,,"Hey @NBCSports seriously, tell me what the hell I need to do to watch live olympics.  Just put a damn price tag on it and I’ll pay it.  I even paid for @peacock and that doesn’t let me watch live.  Why are you so bad at your job!?",2021-08-04 03:12:13+00:00,0,0,0,0
5371352,bsniz,2632,37591,"Husband to @chiarapotenza and dad to 🐶Bucatini. Food, travel, @NDfootball and digital business. EVP / Executive Digital Director @GolinGlobal - opinions my own","Chicago, IL, USA",@PeteSampson_ @peacock @Matt_Fortuna Have you heard anything from @NDFIM @NDFootballPR about what will be shown to paying subscribers during media timeouts? (I'm hoping the answer is not commercials),2021-08-05 20:30:38+00:00,0,0,0,0
22062686,USATH,12118,6528,"Official Twitter of USA Team Handball, the National Governing Body for the sport of team handball in the U.S. 🤾🇺🇸","Colorado Springs, CO","USA Team Handball Board Member and Beach Handball Legend, Ebiye Udo-Udoma (@HandballNinja), appeared on @peacock with @KevinHart4real and @SnoopDogg 
- Check out the video here (last segment): https://t.co/4D48bEcpO9
- Viewing requires registration, but no subscription fee https://t.co/U7VDk0cb02",2021-08-05 20:27:46+00:00,20,2,101,12
5371352,bsniz,2632,37591,"Husband to @chiarapotenza and dad to 🐶Bucatini. Food, travel, @NDfootball and digital business. EVP / Executive Digital Director @GolinGlobal - opinions my own","Chicago, IL, USA","@PeteSampson_ How about this... when the media timeouts happen, instead of seeing commercials on @peacock we get live commentary and analysis from you and @Matt_Fortuna",2021-08-05 20:12:01+00:00,0,1,1,0
828281213421027329,MichaelOngRisk,3824,12809,"Finance expert in enterprise #risk management, #banking, and capital #markets; Professor of #Finance; #Physics; #Mathematics; Seeker of Light; Upholder of Truth",,Olympic Champion Again - Ryan Crouser - and champion for his grandfather!! #RyanCrouser #TokyoOlympics #shotput #family #grandfather #champion #athletics #Olympics @RCrouserThrows @peacock https://t.co/wAHYNqbCif,2021-08-05 18:46:05+00:00,0,0,1,0
1422618186697134082,LostInAnimals1,112,16,"The aim behind creating this page is to capture the beauty of animals and insects.
If you're animals or nature lover then kindly like our page. 

Regards",,"Peacock at desert tharparkar
#PeacockTV 
#peacock @Free2BeeMee @PinkMommy0113 @Fidahus42501503 @_tashamelia @peacockTV @peacock @dawisu @animalpicsdly @RonnyBlair @AnimalPlanet @fantinofantino @Pajaropolitico @CamelPhat @BIRDMAN5STAR @Marvi_S90 @a_leo_in_devon @adriana96161452 https://t.co/Lv8mvbKwzu",2021-08-05 18:23:54+00:00,0,0,4,0
11797042,tjansley,3919,16974,"Digital @PerfectGameUSA ⚾️ // Former Digital for @BlueJacketsNHL 🏒🥅, @trailblazers 🏀, @ColumbusCrewSC ⚽️ // Eastern Michigan Univ. Alum","Columbus, OH",I would like to apply to @Peacock to be the person that only replies with this meme. https://t.co/mdDpZsO5O3,2021-08-05 16:06:59+00:00,1,0,2,0
1455776233,HallDontLie,92,3076,Dad. Pal. Bulls. Red Sox. djsxjsjdnekdijfdenddBEKIND,,@bocxtop @Peacock gotta be in this conversation too,2021-08-05 15:14:53+00:00,0,0,0,0
75713167,MikeBlastoff,620,5119,Independent thinker. Independent professional. Family. Faith. Finances. Fun.,USA,"@CHold @Dame_Lillard Yes, thanks! Do you have the channel? 

I just paid $5 to get Peacock to watch a 2nd half beatdown...now am I going to need to get some other premium package of NBC to watch my country play for a Gold in my favorite sport? @NBCSNorthwest @peacock @peacockTV be better.",2021-08-05 06:51:05+00:00,0,0,1,0
795304076,Eduardo_Refugio,505,24064,"Sports, soccer, wrestling fanatic. Founder/CEO of National Championship Wrestling (NCW). Of course you don’t know what it is... yet.","Ontario, California","@THENEXTBlGTHlNG @peacock @NBCSports In that case, enjoy the game my good sir!",2021-08-05 04:28:37+00:00,0,0,0,0
1205990051517124608,THENEXTBlGTHlNG,696,6205,"@thenextblgthing suspended, so here I am. Frank. 27. I do me & I chill! Immaculate vibes. Sasha Banks 🐐 Makes gifs for fun. You might use em 👇🏽 #MFFL #WHYNOT",LA,@Eduardo_Refugio @peacock @NBCSports I think it’s fixed now. They removed it earlier and was glitching without the time,2021-08-05 04:28:07+00:00,0,1,0,0
795304076,Eduardo_Refugio,505,24064,"Sports, soccer, wrestling fanatic. Founder/CEO of National Championship Wrestling (NCW). Of course you don’t know what it is... yet.","Ontario, California",@THENEXTBlGTHlNG @peacock @NBCSports It shows the scoreboard on the NBC sports app. Try that,2021-08-05 04:26:25+00:00,0,1,0,0
1205990051517124608,THENEXTBlGTHlNG,696,6205,"@thenextblgthing suspended, so here I am. Frank. 27. I do me & I chill! Immaculate vibes. Sasha Banks 🐐 Makes gifs for fun. You might use em 👇🏽 #MFFL #WHYNOT",LA,Put the fucking scoreboard up @Peacock @NBCSports #Basketball #Olympics,2021-08-05 04:21:30+00:00,0,1,1,0
21162677,mjgchick,1053,414819,RIP Mommy 5/18/58-7/29/2011 RIP Brother 3/3/83-6/7/2020,Miami Dade County US,Y’all @peacock got Renegade. Lorenzo Lamas and that long and sexy hair of his and that motorcycle https://t.co/BrUDvSPue4,2021-08-05 03:30:24+00:00,0,0,1,0
1354938594213949443,TeeGriffith,222,23246,"Christian Buddhist. Mom of amazing young adult son, MH advocate, Warrior, BA Linguistics UF 89, ACR, Human Friend of THE Princess Leia, Resurrected, Hare Krisna",,Download @Peacock and while browsing found a classic that really didn't get the props it deserved - #RIPD - can't wait to watch it again!,2021-08-05 01:26:53+00:00,0,0,0,0
36710767,erikkaknuti,1337,4967,"Dir. Strategic Comms @UFCW. Recovering Dem Strategist, Former Klobuchar and MMFA CD, ex Ogilvy VP.","Washington, DC",Hey @NBCOlympics @peacock Why is there no Olympic coverage of Synchronized Swimming? I can Synchronized Diving so why shutting out swimming? Not even On Demand or video clips!,2021-08-05 01:10:08+00:00,0,1,1,0
1042139340032356352,KellyClarksonTV,92659,8721,Weekdays 🌻📺💗,,Watch Kelly sit down with @KevinHart4real on his new show #HartToHeart! Full episode streaming now on @Peacock! https://t.co/BspnfP1Yx7,2021-08-06 21:40:50+00:00,20,5,149,1
27889066,BamaGrad00,1043,67785,"Christian, Single Male Roll Tide Salad Critic of Restaurants, Elvis expert, Bama Grad Free thinker, Watcher of old westerns, Love MLB and CFB, Entreprenuer",Nothingville,"Thank you for putting Mid South and Mid Atlantic Wrestling @peacock @WWE now put WCCW GCW, NWA from the early 80s before WCW",2021-08-06 19:28:19+00:00,0,0,0,0
1407474007922954240,darkwolves720,45,993,We #SavedManifest! Holding out hope for Jachaela. Please be respectful.,Somewhere near #WeTheNorth,"@jackieeeE_O @NBCManifest Yes there is a third season, available on @hulu @peacock based on region. If you thought the S2 cliffhanger was bad, just wait until the third. #SaveManifest #FreeGrandma",2021-08-06 19:18:43+00:00,0,0,0,0
2178163801,Alex_Flinn,1520,7987,"My life's a fairy tale set in Miami. #1 NYT bestselling author Beastly, Love Jacaranda, reader, eater, theater nut. Sometimes I exercise. Wear a mask!","Miami, Florida","@PoorRobin @anneursu @peacock Same here. The Olympics is on the free side of @Peacock, except for a few things. You can definitely watch live coverage for free.",2021-08-06 19:03:27+00:00,0,0,0,0
86348953,PoorRobin,2816,68586,"Word wrangler & bookseller. HEARTSEEKER and RIVERBOUND (Putnum). TELL THE TRUTH, PANGOLIN (2022 Schwartz Books) She/her. Repped by @jenlinnan. #BloggessTribe","Frederick, MD","@Alex_Flinn @anneursu @peacock We have so many subscriptions right now, we definitely can’t afford another. I always appreciated the UK coverage, where you could basically watch whatever event you wanted for free through iPlayer.",2021-08-06 17:30:56+00:00,0,1,0,0
2178163801,Alex_Flinn,1520,7987,"My life's a fairy tale set in Miami. #1 NYT bestselling author Beastly, Love Jacaranda, reader, eater, theater nut. Sometimes I exercise. Wear a mask!","Miami, Florida",@PoorRobin @anneursu @peacock Or live. But sometimes that's 4:00 a.m.,2021-08-06 17:27:41+00:00,0,0,0,0
2178163801,Alex_Flinn,1520,7987,"My life's a fairy tale set in Miami. #1 NYT bestselling author Beastly, Love Jacaranda, reader, eater, theater nut. Sometimes I exercise. Wear a mask!","Miami, Florida","@PoorRobin @anneursu Do you have @Peacock? I've only used it to watch live coverage, but it looks like (even on the free app), you can go to the sport you want, once it's been broadcast once. Also, they have coverage on other cable channels besides the broadcast NBC.",2021-08-06 17:25:36+00:00,0,2,1,0
852017868,msomerlot,1357,16132,"all things I find of interest or useful, explained in the way I can best","Warm & Cheerful Cville, Ohio",What’s up with @peacock and this camera level? It’s all close up and out of focus,2021-08-06 11:24:56+00:00,0,0,1,0
1022068185204449280,simonmckim,52,1680,"Host of @andalsoaswellas, fan of baseball, learner of Gàidhlig, and author","New Albany, IN",Hey the guys on @peacock who’ve been disrespecting every Olympic event got ahold of race walking. And wow were those results predictable.,2021-08-06 10:57:00+00:00,0,0,3,0
1084571763441324033,BertrandAnnick3,7,162,,"Lower Rhine, Alsace",@USATH @HandballNinja @peacock @KevinHart4real @SnoopDogg @ihf_info @TeamUSA @USBeachHandball @rodger @eric_nehm @MichaelSHolley @chrisbrockman @LeeSchechter @Nate_Tice @CharlesPPierce Such a promotion 💪😊,2021-08-06 10:44:22+00:00,0,0,3,0
71604391,HandballNinja,720,3067,I was just on TV with Kevin Hart & Snoop Dogg Competed in 🇧🇷🇺🇾🇻🇪🇭🇺🇦🇺🇨🇿🇫🇷🇨🇳🇪🇸🇷🇺🇲🇽🇲🇾🇹🇹🇶🇦🇮🇨🇵🇹🇮🇹,"Los Angeles, CA","@USATH @peacock @KevinHart4real @SnoopDogg @ihf_info @TeamUSA @USBeachHandball @rodger @eric_nehm @MichaelSHolley @chrisbrockman @LeeSchechter @Nate_Tice @CharlesPPierce You can also watch the segment on YouTube 
https://t.co/lhegO5uhPt",2021-08-06 07:17:42+00:00,0,0,8,0
713189033275314177,AvgeekJoe,1346,48389,"Vaccinated photographer, transit & open government & vaccination advocate + ""military jet superfan"" who ""flies"" in DCS World

Views & errors mine alone, thanks!",USA,"I had to get on @peacock because @yuhline and @Biaggi4NY are rocking out on @MehdiHasanShow...

Now if only @MSNBC's @TheLastWord would kindly please book real American public servants.  Please, as I am getting this mug tomorrow: https://t.co/KjDSZv8NMa",2021-08-06 06:11:35+00:00,0,0,0,0
1418061522379710464,Nashville_Cat21,22,688,Lover of all things sports and music,"Nashville, TN",@Peacock will eventually take over as the go to #streaming service. Pretty impressive catalogue plus the sports options are top notch.,2021-08-07 21:10:42+00:00,0,0,0,0
2685622896,holy7roller,14,2217,,,@prevention23 @IndyCar @IMS @MusicCityGP @peacock It's insane. Grinds the car &amp; driver to hamburger.,2021-08-07 20:46:28+00:00,0,0,0,0
2685622896,holy7roller,14,2217,,,@tiadonna14 @IndyCar @MusicCityGP @peacock @peacockTV Seriously!!! Makes me so mad!!,2021-08-07 20:45:21+00:00,0,0,0,0
1250405283425386496,deadlevelbest,45,4897,"""I dunno, I just keep doing it"" - Benjamin Allbright",,@afcajaxpro_ @Bounce7 @IndyCar @MusicCityGP @peacock That depends on which cube day you are on,2021-08-07 20:41:38+00:00,0,0,1,0
85342312,EStreetBlitz,86,4547,Event Manager :: Past barista/bookseller (RIP Borders 345) :: Hopeless romantic :: Lover of live music :: NEVER sarcastic ;) :: **Opinions All Mine**,,@tiadonna14 @IndyCar @MusicCityGP @peacock @peacockTV Because @peacockTV has the worst live event infrastructure of any streaming service. Can’t adapt on the fly.,2021-08-07 20:41:21+00:00,0,0,0,0
2884668075,f1fanspitstop,104,13379,F1 is my passion https://t.co/S7TAcBuDIc f1fanspitstop,"South West, England",@IndyCar @MusicCityGP @peacock This circuit is a beast love it 💪🏻👊🏻✌🏻,2021-08-07 20:40:48+00:00,0,0,0,0
961525424118431744,afcajaxpro_,427,17792,Ajax || CSV Apeldoorn || Home & Away || F1 || F2 || Indycar || 77 bezochte wedstrijden in 19/20 || https://t.co/iOkRtuup6A,Ugchelen,@deadlevelbest @Bounce7 @IndyCar @MusicCityGP @peacock So I guess it will be delayed here in the Netherlands too due to time difference?,2021-08-07 20:40:23+00:00,0,1,0,0
1265780443426758657,tiadonna14,57,3854,Just getting started...,,"@IndyCar @MusicCityGP @peacock Thanks for the update, but why not show something on @peacockTV to talk about the delay and let the fans know?",2021-08-07 20:39:20+00:00,0,2,2,0
1351945708795006980,dell1776,17,1014,,,"@IndyCar @MusicCityGP @peacock Well, now I wanna know what the on track activity is.",2021-08-07 20:39:00+00:00,0,0,2,0
