author_id,username,author_followers,author_tweets,author_description,author_location,text,created_at,retweets,replies,likes,quote_count
797569158,KathyMills12,1155,7330,Teacher+Mom+Math & Science Nerd.  Not a girly girl...I LOVE spiders. Extrovert. If you are a $$ for followers acct -- don't bother! NOT looking to hookup.,"Turlock, CA","@AppleTV @hulu @paramount @warner @peacock @Roku aren't you curious why we're still so passionate about Prodigal Son?  Have you checked it out? Pretty 🔥, right?#ProdigiesAreRuthless and we will be your most loyal subscribers when you #SaveProdigalSon!  C'mon we're waiting. 💋 https://t.co/kLV8RKRuRZ",2021-08-19 02:39:55+00:00,0,0,0,0
29785118,wyeager,212,5683,"I'm a pastor in Liberty Township, Oh. I love Jesus and love communicating about him to others.","West Chester, OH",@BillNance79 @netflix @AppleTVPlus @peacock There was talks of a peacock reboot/revival at some point.,2021-08-19 02:25:12+00:00,0,0,0,0
14347872,xjm716,805,26356,Follower. Husband. Father. Grandfather. Streak Runner. Buckeye. Lead Pastor @WestWayChurch,"Gering, NE",@BillNance79 @netflix @AppleTVPlus @peacock When he jumped into Lee Harvey Oswald…that was legit.,2021-08-19 02:23:36+00:00,0,1,0,0
139113752,BillNance79,1116,7707,"Husband and father to a crazy fun family! Youth ministry speaker, writer, and trainer. Work daily to help end hunger. Huge sports fan!","Commercial Point, OH","Why has there never been a “Quantum Leap” movie to wrap up the series properly? We have 100 streaming services, you think a @netflix or @AppleTVPlus or @peacock would be smart enough to  do it",2021-08-19 02:01:19+00:00,0,3,1,0
1410770211863764995,brandon_tsw,5,162,"My name is Brandon The Stone Warrior voice and singing impressions 
YouTube https://t.co/IVwhc2j3Ot…
PlanetMinecraft https://t.co/XNlyTWpl1B",Kenosha Wis,@TheDragonRed1 @Dreamworks @hulu @peacock I wanna know when’s the season 4 of dinotrux supercharged.,2021-08-20 21:56:37+00:00,0,0,0,0
1386447009331261444,MancandyCine,777,6836,"Principe de Disney 🤴
Hot Geek 🔥
CUENTA NUEVA
IG y Tik Tok : guillemancandy
#MancandyAtTheMovies 🎥
#ElCineEnElCine 
Creo en Dios 🙌 mi Papito 🙏 y Bette Davis",,@Dreamworks @hulu @peacock Yesss 😀😃 colorful as ever 🥰,2021-08-20 20:38:32+00:00,0,0,0,0
1413501220564525061,youvebeenlokied,2,136,KN1GHT5LAYER | XXI |🇱🇰,Sri Lanka,@Dreamworks @hulu @peacock @Dreamworks is it too much to ask to bring back #Hiccup and #Toothless for one last @netflix series????,2021-08-20 19:18:59+00:00,0,0,1,0
1354963915424333828,JoeRobitaille1,30,20,"dad, family man, lover of life!","Maine, USA",@avpbeach @peacockTV @alixklineman @AprilRossBeach @FalynFonoimoana @shoot802 I would love to watch but not buying @peacock sorry . Go back on nbc live on sundays .,2021-08-20 18:22:19+00:00,0,0,0,0
1200234656911757313,TheDragonRed1,103,3744,"A Fan Who Like to do Fanarts, Editing and Meme like for #ATLA, #TLOK, #InfinityTrain, #TheOwlHouse and #DreamWorks",,"@Dreamworks @hulu @peacock Make Sequels
#OvertheHedge
#RiseOfTheGuardians https://t.co/plDUTNtArn",2021-08-20 14:31:16+00:00,0,1,1,0
1182138087188520960,Le_Mans_66_VF,21,2163,"Le Mans 66 Film Streaming Gratuit-2019 FR. Comment regarder Le Mans 66 Film En ligne Gratuit? Oui, Meilleur endroit pour regarder Le Mans 66 Complet Streaming👇",,"#RT @Dreamworks: Get ready for a troll new season of fun! Join in for more tricks, more treats and more Tiny in all new episodes of #TrollsTopia #DreamWorksTrolls, coming to @Hulu and @Peacock on September 2nd! https://t.co/hEa31kZR3X",2021-08-20 14:11:23+00:00,0,0,0,0
25341996,Dreamworks,1914349,13341,The official Twitter page for DreamWorks Animation.,"Glendale, CA","Get ready for a troll new season of fun! Join in for more tricks, more treats and more Tiny in all new episodes of #TrollsTopia #DreamWorksTrolls, coming to @Hulu and @Peacock on September 2nd! https://t.co/VZGW00Agjv",2021-08-20 14:00:30+00:00,25,7,86,1
2822213995,Budman402,128,1661,"I like smoking good Bud, and i like good wrestling.",Long Beach California,"@paramountplus I get an error whenever i try to watch Zoey 101. Im binge watching and now it gives me an error. All the other tv shows load. But when i click on Zoey101, i get this. Guess ill use @Peacock and watch some 90s wrestling 😪 https://t.co/pAk1QqWYlM",2021-08-20 05:28:12+00:00,0,0,0,0
16981862,LUNI_TUNZ,636,113557,Anime cartoons sports (NBA and WNBA) voice acting comic books and wrestles. Followed by 2 Cavs mascots. Was in a Cavs skit a halftime and https://t.co/e0Swy8JSs,"Cleveland, OH.","Also, nice to see @Peacock not keeping their end of the bargain and rewind STILL is not a feature ""by SummerSlam.""",2021-08-21 23:54:29+00:00,0,0,0,0
59030123,k1mm1poo,8,94,To have someone special you must play the game to win i'm told. What and how do you do this?,,@peacock @wwe about done with the poor service of Peacock network great choice in a partner WWE.,2021-08-21 23:51:16+00:00,0,0,0,0
33944705,ShaolinShoGunMA,1031,143329,"Former member of R&B group, LeVert. Koldblooded Nupe. 👌🏾 ♦️ Podcast Host: #ThePush on @WrassleCast; Former Site Expert: @SwarmnSting","Charlotte, NC",#SummerSlam is in less than 15 minutes; is everything from the network on @Peacock as we were told?! #SummerOfSlams,2021-08-21 23:47:10+00:00,0,0,0,0
1165777963671072768,MrClownSocks,68,239,"Pro-Wrestling, Film Enthusiast, Video Gaming, Oh, and my real name is Michael.","Davenport, IA","Good lordt, @peacock runs the longest delay on live #WWE events. #SummerSlam",2021-08-21 23:03:18+00:00,0,0,0,0
711263426480349184,JLNYlimited,15,533,"🍩 hardcore , 🐻 eat beats, Mets ⚾️, wrastlin’",Antarctica,"@peacock why doesn’t your app ever let me watch ANYTHING?!?!?! @wwe you guys messed up by switching to peacock 

LG tv, if you ever want to maybe update your app so that maybe the show plays. #peacocktvsucks https://t.co/qqHHcPNdqf",2021-08-21 23:00:59+00:00,0,0,0,0
30952201,steelers1288,643,118558,"Author of The Chair 🪑. The man in the brown macintosh loves a lady who is dead. I was found in a bog near Blaenplwyf, Wales 🏴󠁧󠁢󠁷󠁬󠁳󠁿. Buy me a Kandinsky.","Houston, TX","It is with great sadness that I announce to you that I have unfollowed @Peacock . This was done so for unspecified reasons. Thank you for your prayers and respecting my privacy during this difficult time. In lieu of flowers, I ask that you donate to your favorite charity.",2021-08-21 21:19:47+00:00,1,0,3,0
1109830591573311489,LaxGoalieMom1,98,2656,"Was a goalie mom (11sns), now he's a FoGo. Retired Navy. A rainy day at a field is better than a sunny day at home! Only here for the sports! #GPG #NewberryMLax","Naptown, MD","@ajbrandolini @peacock @PLLCannons @PLLAtlas Ohhhh, I leave the room during the ads lol",2021-08-21 20:24:50+00:00,0,0,0,0
768593129469468673,ajbrandolini,1011,6199,"Co-Founder of @alphaechoprojct. 
Philly native, Bmore adoptee. 
U of Richmond Lax & B-School // VCU MBA in Brand Strategy // Sports + Business",,@LaxGoalieMom1 @peacock @PLLCannons @PLLAtlas They’re playing the commercial a little less than usual but it’s for a documentary on the Epstein case.,2021-08-21 20:18:53+00:00,0,1,0,0
876242429749362688,Jaslicker97,14,441,NASCAR indycar supercross pennstate pitt wvu steelers pens pirates orioles,,@peacock fix your audio for the motorcross race. It continues to tune in and out and its getting annoying.,2021-08-21 20:16:45+00:00,0,0,0,0
1109830591573311489,LaxGoalieMom1,98,2656,"Was a goalie mom (11sns), now he's a FoGo. Retired Navy. A rainy day at a field is better than a sunny day at home! Only here for the sports! #GPG #NewberryMLax","Naptown, MD","@ajbrandolini @peacock @PLLCannons @PLLAtlas Wait, what??",2021-08-21 19:48:52+00:00,0,1,0,0
768593129469468673,ajbrandolini,1011,6199,"Co-Founder of @alphaechoprojct. 
Philly native, Bmore adoptee. 
U of Richmond Lax & B-School // VCU MBA in Brand Strategy // Sports + Business",,@LaxGoalieMom1 @peacock @PLLCannons @PLLAtlas Personally I prefer @peacock avoid the   in-depth storyline about the Epstein saga. Not awesome.,2021-08-21 19:48:21+00:00,0,1,0,0
1109830591573311489,LaxGoalieMom1,98,2656,"Was a goalie mom (11sns), now he's a FoGo. Retired Navy. A rainy day at a field is better than a sunny day at home! Only here for the sports! #GPG #NewberryMLax","Naptown, MD","Hey, @peacock Can we not have the car race closed captioning over the @PLLCannons and @PLLAtlas playoff game?? 

Thanks",2021-08-21 19:43:10+00:00,0,1,1,0
83893739,USCHolmey,1049,82797,Swimming in the deep end - most of the time . . #TeamSYM . . Shutdown Corner . . Godfather Of The #JTP . . I've been compared to Radiohead and Daniel-Day Lewis,9 iron to the beach in O.C. CA,@Ryan_n_Laguna @peacock I saw until like 19-16 in the 2nd when @Peacock decided I would rather look at a black screen and hear audio of a track meet......,2021-08-21 19:27:25+00:00,0,0,1,0
1072449835,Ryan_n_Laguna,619,9402,Los Angeles Sports Radio Content Contributor. Dodgers. Lakers. Rams. Kings. Trojans.,858 / 310,@USCHolmey @peacock Yes they beat Hyden/Santos,2021-08-21 19:24:56+00:00,0,1,0,0
83893739,USCHolmey,1049,82797,Swimming in the deep end - most of the time . . #TeamSYM . . Shutdown Corner . . Godfather Of The #JTP . . I've been compared to Radiohead and Daniel-Day Lewis,9 iron to the beach in O.C. CA,@Ryan_n_Laguna So I guess they won lol.  They cut away from it on @Peacock.,2021-08-21 19:19:19+00:00,0,1,0,0
83893739,USCHolmey,1049,82797,Swimming in the deep end - most of the time . . #TeamSYM . . Shutdown Corner . . Godfather Of The #JTP . . I've been compared to Radiohead and Daniel-Day Lewis,9 iron to the beach in O.C. CA,@avpbeach @CBudinger @Ricardo_VDP @caseypatt @johnhyden This match feed just changed to the Prefontaine Classic on @Peacock.  It would be awesome to be able to have seen the end of it.,2021-08-21 19:08:36+00:00,0,0,1,0
83893739,USCHolmey,1049,82797,Swimming in the deep end - most of the time . . #TeamSYM . . Shutdown Corner . . Godfather Of The #JTP . . I've been compared to Radiohead and Daniel-Day Lewis,9 iron to the beach in O.C. CA,@avpbeach I really want to watch beach vb.  I really want to care.  But @Peacock is making it impossible.,2021-08-21 19:07:47+00:00,0,0,0,0
104617416,gianmaster191,930,37416,"""I've learned that people will forget what you said, people will forget what you did, but people will never forget how you made them feel.""  ~Maya Angelou",,"@Angel_Sau @Nike @Peacock 3:35pm ET - The Prefontaine Classic 

https://t.co/N7gJMNc4T4",2021-08-21 18:46:15+00:00,2,1,6,0
309332415,NashvilleFan65,550,44414,"I love Nashville (#FDF Crew, #NashvilleCMT #EverySingleFriday #Nashie), yoga, kayaking, skiing and all animals","Farmington, Connecticut",I downloaded @Peacock just to watch #Season3 #SaveManifest - it is not tied up at all https://t.co/PA7hzi2ZMz,2021-08-21 18:38:42+00:00,0,0,0,0
248886739,MattJK21,61,1577,,,"@wwe Summer Slam seems kind of lame today. I wonder why that is? Hey @WWEonFOX @peacock @usa_network tell WWE to get better, because @AEW is making @wwe @VinceMcMahon @TripleH @StephMcMahon look like a bunch of fools right now. https://t.co/Ho7YEDMOoN",2021-08-21 18:35:14+00:00,0,0,0,0
20020053,indyracefan12,99,3341,"History fanatic, genealogist, IndyCar, Indiana & Duke basketball fan. Raising 1 tiny fan (Graham), 1 crazy dog (Magnolia) and crazy cat (Stella)
#isitaugustyet","Tomball, TX not by choice!",Anybody else suddenly seeing muted lacrosse?? @peacock @IndyCaronNBC,2021-08-21 18:15:28+00:00,0,0,0,0
46658897,nicharcourt,7786,46640,This is my personal Twitter account | Time traveling w/out a handbrake ODAAT | Sam & Luna’s Dad | @KitaKlane's manager | Broadcast/Music Journalist | v/o,a police phonebox,@NBCSportsSoccer you guys suck. I’m tuned in for the @AVFCOfficial game and while we’re waiting for the teams to start second half your screening man city game. If I wanted to watch that I’d be on @peacock,2021-08-21 15:05:14+00:00,0,0,0,1
1030472590010314752,Erik_Somerville,125,2293,yoooooo,Los Angeles,Fuck you @peacock,2021-08-21 12:04:34+00:00,0,1,1,0
217694179,JackJoachim,207,7116,Mississippian,United States,@LFC Unless you’re in the USA and don’t have @peacock.,2021-08-21 11:31:08+00:00,0,0,0,0
1270000066489712641,bartek287197,13,228,Sup. i tweet and retweet from time to time.,idk lmao,@Dreamworks @hulu @peacock more trollstopia? don't mind if i do!,2021-08-21 07:33:22+00:00,0,0,0,0
1358088909708746755,RobertVuki,12,310,Big fan of HTTYD trilogy. I also love to play football and accordion. 🙂,Croatia,@Dreamworks @hulu @peacock Make new httyd movie or TV series please,2021-08-21 06:02:04+00:00,0,0,0,0
1409866752939511811,WritesYvette,411,8966,NEW ACCOUNT to #SaveProdigalSon since my last one decided to just die. I also write things. she/her,,"Hey there @netflix @hulu @AppleTV @warnerbrostv @Roku @skytv @PrimeVideo @peacock We millions of worldwide fans were just wondering if you'd like to #SaveProdigalSon It'll bring you more subscribers, money and a great, wacky show which normalises mental health! #IDontLose Please?",2021-08-21 01:57:41+00:00,8,0,12,0
616635716,keddle01,4933,135949,,,@giimoozaabi @peacock @hulu He seems ok! I hope he’s ok,2021-08-21 01:51:12+00:00,0,0,1,0
344314454,giimoozaabi,7768,69624,"I love to: chat, shop,talk shit. A purveyor of puns, and peccadillo's. Often pedantic and punctilious. Liberal Democrat and part of LGBTQ community. He/Him/Who?","Pittsburgh, PA.",@keddle01 @peacock @hulu I seem to remember he had lost a lot of weight back then.. I hope he's okay.,2021-08-21 01:50:16+00:00,0,1,1,0
616635716,keddle01,4933,135949,,,@giimoozaabi Me too! You should check out Debris which you can stream on @peacock or @hulu,2021-08-21 01:49:39+00:00,0,1,1,0
256715671,theclaw4god,136,8314,"Family, friends, faith, Reds baseball, Ohio State, American Idol. Unofficial Mayor of Jumbo, Ohio. Oh and I resell cards on eBay. https://t.co/bkeeFoXGfQ",,"My child doesn’t know @peacock as peacock, she calls it monkeys whenever it comes on because that girl can marathon curious George like a pro.",2021-08-22 19:54:57+00:00,0,0,0,0
40376000,MikeDForThree,751,43917,I am not available because I am playing a game that takes up the whole screen.,,@USCHolmey @peacock @avp This tweet is gonna do numbers,2021-08-22 18:06:01+00:00,0,0,0,0
83893739,USCHolmey,1049,82797,Swimming in the deep end - most of the time . . #TeamSYM . . Shutdown Corner . . Godfather Of The #JTP . . I've been compared to Radiohead and Daniel-Day Lewis,9 iron to the beach in O.C. CA,"If you have @Peacock, the best current rivalry the @AVP has to offer, the two US Olympic pairs - April/Alix vs. Claes/Sponcil - is about to start.....",2021-08-22 18:01:11+00:00,0,1,0,0
1200110278777753601,PositiveWfan,94,4524,"Family, friends, dogs. Star Wars is for fun if you are complaining, you are doing it wrong. 1/6/21 never forget!",,@TheMarySue I used to binge it but @peacock is so terrible I can’t stand it.,2021-08-22 17:13:53+00:00,0,0,0,0
307019875,klex10,26,1149,Manchester United Fan! #MUFC,United Kingdom,Watchung the game on @peacock sucks ass. I want to hear pundits talking about the game rather than this crap they are putting on. #mufc #SOUMUN,2021-08-22 13:58:46+00:00,0,0,0,0
25916876,ElAcordeonachi,150,10273,"Holder of a 33rd Degree Black Belt in the Martial Art (and craft) of constructing Origami Boulders.
Amateur Zabaglionist",Central Minnesota,"Also, to Lesnar.

Booooooooooooooooooooooooooooooooooooooooooooooooooooooooooooooooooooooooooooooo looks like I picked an even better time to stop watching @WWE @peacock booooooooooooooooooooooooooooooooooooooooooooooooooooooooooooooooooooooooooooooooooooooooooooooooo #SummerSlam",2021-08-22 04:10:13+00:00,0,0,0,0
16121244,Girl_GoneMild,1873,64365,#BLM 🤼 🏳️‍🌈 👩🏾‍🤝‍👨🏻🕹🎥🐈‍⬛,United States,@MrClownSocks @peacock I hate @peacockTV so much.,2021-08-22 04:01:42+00:00,0,0,1,0
1165777963671072768,MrClownSocks,68,239,"Pro-Wrestling, Film Enthusiast, Video Gaming, Oh, and my real name is Michael.","Davenport, IA",@Girl_GoneMild 😂😂😂 Ain’t @Peacock trash.,2021-08-22 03:54:16+00:00,0,1,1,0
954351274731991041,vastneighbor25,10,3033,Regrets the day he ever took an interest in politics. Should have stuck to sports fandom.,,@zigx6969 @peacock @WWENetwork WWE Network had it Day 1. So they force everyone in the US to use this trash app with less functionality than we had. It’s a giant eff you to their fan base.,2021-08-22 03:14:16+00:00,0,0,0,0
955961820,zigx6969,4923,64155,Why Get Thinna When U can Git Mo Dinna,Cardboard box under a bridge,@vastneighbor25 @peacock @WWENetwork That’s the biggest gripe I had with peacock,2021-08-22 03:12:10+00:00,0,1,0,0
1231668314717458435,LittleOmar5,14,1345,,Philadelphia,@vastneighbor25 @peacock @WWENetwork Yeah I miss the network,2021-08-22 03:11:24+00:00,0,0,0,0
954351274731991041,vastneighbor25,10,3033,Regrets the day he ever took an interest in politics. Should have stuck to sports fandom.,,@peacock is fucking trash. Just got home and can’t start #SummerSlam from the beginning? What a damn joke. @WWENetwork had no issues with start from beginning. Your app is trash,2021-08-22 03:10:38+00:00,0,2,1,0
481677069,JacobAlbua,18,13129,,USA,@WWENetwork @Goldberg @fightbobby @peacockTV @peacock should cut the feed at this point. Time to go to sleep.,2021-08-22 03:07:20+00:00,0,0,0,0
2368283969,Lon_wolf06,55,3403,"LIFE IS LUV
LUV IS LIFE",The Bronx,Fuuuuuuck you @Peacock you fuckin piece of SHYT. You fuckin go down now you motherfuckin piece of SHYT. You had since Fuckin WrestleMania to fix this fuckin SHYT. Why dafuck are you still crashing during the fuckin PPV,2021-08-22 02:30:54+00:00,0,0,0,0
274451580,quotetheraven79,493,23498,"I'm a joker, i'm a smoker, i'm a midnight toker. I sure don't want to hurt no one! Future podcaster(of what I don’t know), #ShockMonkey & #mutantfam #4life","E'vil, IN","@BeckyLynchWWE congrats on becoming EXACTLY what you hated, on #Summerslam. . . It’s all full circle!  Fuck this #horsewoman garbage!  Thanks for making canceling @peacock easier",2021-08-22 02:22:33+00:00,0,0,0,0
25916876,ElAcordeonachi,150,10273,"Holder of a 33rd Degree Black Belt in the Martial Art (and craft) of constructing Origami Boulders.
Amateur Zabaglionist",Central Minnesota,"I think I'm done.  Going to drop my @Peacock sub. Hah, doesn't help that the next PPV is for the Saudis.  I hate contributing to that as well. Going to finish watching #SummerSlam , it's not the rest of the wrestler's fault WWE did this. Vote with my wallet. https://t.co/DUVLibeUjX",2021-08-22 01:47:15+00:00,0,0,0,0
35261699,tigersgrizz07,133,33061,Enjoy conversation on many subjects. Memphis State Alum & basketball and football fan,,⁦@nbc⁩ I did a search on original Law &amp; Order series Season 2 on NBC (where they originally aired) these are nonsensical shows that came up on search. ⁦@Peacock Premium starts with season 13. Where are they steaming @NBC? https://t.co/Jmff3i7zwI,2021-08-22 01:39:36+00:00,0,0,0,0
100697640,MissMySnicka,503,277224,"Excessively Black. My office hours are from 9 to 5. 7/17/21: Alexander Scamilton deactivated, but for how long 👀",USA (for now),Yo I AM SUING y’all @wwe @peacock #summerslam,2021-08-22 01:38:32+00:00,0,1,0,0
100697640,MissMySnicka,503,277224,"Excessively Black. My office hours are from 9 to 5. 7/17/21: Alexander Scamilton deactivated, but for how long 👀",USA (for now),Nah I want my money back @peacock @WWE #summerslam,2021-08-22 01:36:45+00:00,0,2,0,0
616635716,keddle01,4933,135949,,,Would you love to see more John Noble? So would I in a season 2 of Debris maybe @peacock or @hulu #DebrisisNoble  #SaveDebris https://t.co/N47BSmmVUS,2021-08-22 01:18:40+00:00,6,0,6,0
43776861,iamMimiChelles,1746,58363,"🇭🇹#RockMom; I’m Cheeky, don’t take it personal; #Writer #Sneakerhead #TurnbuckleTalk Tues/7p ET #TwitterSpaces; #SuperKicksandHeels Thurs/8p ET #StereoApp",Parts Unknown,Damn @Peacock Really? Summerslam,2021-08-22 01:17:16+00:00,0,0,0,0
2706645272,profjimmyc,202,12704,,,@Peacock your app sucks for watching WWE events.,2021-08-22 00:53:41+00:00,1,0,1,0
270090049,DarthJimbo,61,1353,"Transplanted in Chicago.Responsible for random acts of awesomeness since 1977.Mets,Jets, Rangers,Knicks,Syracuse Orange. Hallelujah, where's the Tylenol?","Chicago, IL","When @CMPunk broke the Internet last night, he also broke the #summerslam2021 stream 🤣🤣@peacock @WWE get it together! #AEWRampage #",2021-08-22 00:38:47+00:00,1,0,5,0
100697640,MissMySnicka,503,277224,"Excessively Black. My office hours are from 9 to 5. 7/17/21: Alexander Scamilton deactivated, but for how long 👀",USA (for now),Okay @peacock get it together...my internet connection was just fine during the kickoff now you wanna act up #summerslam bring back the wwe network for us customers dang it 😭,2021-08-22 00:10:48+00:00,0,0,1,0
810745981,Little_Sparowe,524,28896,"Former TAY Author; currently writing kayfabe for the #RomanEmpire & Real Talk for me.  RTs reflect interest, not necessarily endorsement.  #ThankYouRoman 🧡",,"@southrnbygrace @peacock What worked for me last time was to go out to the main page and go in through Sports.  (Not saying you should have to do that, but hoping something will work for you!)",2021-08-22 00:06:40+00:00,0,0,1,0
25620580,southrnbygrace,41,12686,Imperfect but blessed child of God. A proud Confederate and a Patriot.,Southern Girl Thru and Thru,Summerslam hasn't even STARTED on @Peacock yet. I swear the move to this platform was ridiculously stupid!,2021-08-22 00:05:36+00:00,0,1,1,0
377753646,pupusaass,284,25232,just a guy who retweets things and didn’t ask for ur opinion,Kepler-22B,@Peacock you better not have shitty streaming tonight or I’m gonna cancel and stream illegally and there’s nothing you can do about it,2021-08-22 00:01:48+00:00,0,0,0,0
57243327,ckt0429,188,187405,Happier than I have ever been my entire life. 🦋,"Seattle, WA",Watching @Downton Abbey season 1 on @Peacock app. 🇬🇧,2021-08-23 22:59:20+00:00,0,0,0,0
22782543,TedatACA,3516,37631,"VP, Communications, ACA Connects","Washington, D.C.",@Peacock is One Year Old - Here are Its Most Popular Movies and TV Shows So Far | @CordCuttersNews https://t.co/INPZRUwpZQ https://t.co/hCF0kjIUJ5,2021-08-23 22:11:55+00:00,0,0,0,0
1272655350,threefortyoneam,27,2812,,,Hats off to @peacock for adding Candyman and the Nightmare on Elm St collection.,2021-08-23 16:51:23+00:00,0,0,3,0
1384871971993919491,ChrisOfSalop,47,774,"Tech/sport/more writing at @ByChrisSmith. Here lies personal musings of Salopian, LFC fan, wrasslin' & pop punk icon. In my own mind I’m, I’m the dopest trip",Pinkerton,"Jesus @Peacock, still can’t figure out how to start something over rather than joining everything live? Dogshit.",2021-08-23 01:20:34+00:00,0,0,0,0
19791874,jurisdiva,706,36711,"Writer, attorney, sports/legal analyst and general all around good gal","ÜT: 33.75933,-118.139319",So.....@Peacock.....been 25 minutes. Same screen waiting for @RichEisenShow,2021-08-24 16:28:46+00:00,0,0,0,0
2280378522,4GCoaching,51,198,Our aim is to provide all children with the opportunity to access a wide variety of sports. This enables children to keep fit and try something new!,Sheffield,"@AlexMiller91 @_hazzy It is fantastic to see players who care.@Peacock-Farrell,@Swfc, WAWAW.",2021-08-24 10:46:07+00:00,0,0,0,0
57243327,ckt0429,188,187405,Happier than I have ever been my entire life. 🦋,"Seattle, WA",Watching @Downton Abbey season 2 on @Peacock app. 🇬🇧,2021-08-24 02:12:15+00:00,0,0,0,0
22866771,jrgray,124,5709,"Husband of one, father of three, Ramblin' Wreck, Disney fan, Ex-Pittsburgher in the home of the mouse, helluva an engineering manager.","Clermont, FL",@theofficetv @peacock A very special episode of the Office where the all have to get vaccinated against Covid-19. Angela is opposed for religious reasons. Ryan is opposed because the vaccine embeds a chip inside you. Dwight refuses because Schrute blood is already immune. 1/,2021-08-24 02:09:48+00:00,0,1,0,0
119418824,cvivian86,453,6279,"Communications pro at UF/IFAS, UF alum, paddleboarder, choral singer, cat lover. Opinions my own/RTs not endorsements. *talitha kuom*","Gainesville, FL",@Adweek It was so fragmented. I subscribed to @Peacock but could not watch much live. What I did watch was on @Sling. The whole thing was a mess.,2021-08-25 18:10:31+00:00,1,0,3,0
1420775298069680132,Homeistheheart5,76,1386,#911LONESTAR #WILSON  #ChandlerMassey  and  #ZachTinker #LUMI #JNJ   #Lucifer  #Netflix  #Peacock #DOOLBeyondSalem   #EastEnders #Hollyoaks #BnB #YnR,,OMG !!!!  #WilSon looks good and sexy #BeyondSalem @PEACOCK @NBC @SONY  I LOVE IT !!!!! I am excited https://t.co/1sVk7wku8o,2021-08-25 17:49:52+00:00,3,3,10,1
250981352,Kim__Fuller,937,9465,"Former White House, FEMA, NTSB and Pentagon official. Crisis Communications professional.",Wash D.C./LA/Tulsa,@MStockwell01 Thank you for your service AND for respresenting our country at the #Olympics! Watching you on @Peacock.  Longshot my butt!! You proved you can do anything!!,2021-08-25 15:38:17+00:00,0,0,0,0
3261168666,p0larcs,84,1049,breh,"California, USA",@terrycrews @peacock first terry crews i love you,2021-08-25 00:05:38+00:00,0,0,0,0
797569158,KathyMills12,1155,7330,Teacher+Mom+Math & Science Nerd.  Not a girly girl...I LOVE spiders. Extrovert. If you are a $$ for followers acct -- don't bother! NOT looking to hookup.,"Turlock, CA","Tuesdays are for #ProdigalSon, at least until @FOXTV canceled it!! Who wants to fix their error and reap the $$$? @AppleTV @hulu @paramount @skytv @BBCAMERICA @warnerbrostv @peacock @netflix https://t.co/Lspvm3UTP0",2021-08-25 00:05:35+00:00,0,0,0,0
